date,Unnamed: 0,day,new_id,retweets,favorites,text,ss_compound
2018-04-07,33901,2018-04-07,2501,15358,70837,Just spoke to @ JustinTrudeau to pay my highest respect and condolences to the families of the terrible Humboldt Team tragedy. May God be with them all!,-0.9006
2018-04-08,33906,2018-04-08,2502,12988,60633,....to pay. Open area immediately for medical help and verification. Another humanitarian disaster for no reason whatsoever. SICK!,-0.8528
2018-04-09,33914,2018-04-09,2503,8822,47719,"Congratulations to Patrick Reed on his great and courageous MASTERS win! When Patrick had his amazing win at Doral  years ago, people saw his great talent, and a bright future ahead. Now he is the Masters Champion!",0.6588
2018-04-10,33918,2018-04-10,2504,14260,72724,A TOTAL WITCH HUNT!!!,-0.5229
2018-04-11,33923,2018-04-11,2505,7207,32010,"....doing things that nobody thought possible, despite the never ending and corrupt Russia Investigation, which takes tremendous time and focus. No Collusion or Obstruction (other than I fight back), so now they do the Unthinkable, and RAID a lawyers office for information! BAD!",-0.8643
2018-04-12,33932,2018-04-12,2506,9316,49695,"America<U+2019>s greatest treasure is our people <U+2013> and my Administration HEARS YOUR VOICE and HAS YOUR BACK. We are fighting to give every American a future of dignity, purpose and pride. AMERICAN SPIRIT is back! # TaxCutspic.twitter.comoSGZeirBf",-0.9335
2018-04-13,33942,2018-04-13,2507,14192,70635,"....untruthful slime ball who was, as time has proven, a terrible Director of the FBI. His handling of the Crooked Hillary Clinton case, and the events surrounding it, will go down as one of the worst <U+201C>botch jobs<U+201D> of history. It was my great honor to fire James Comey!",-0.9749
2018-04-14,33948,2018-04-14,2508,25884,93343, <U+2026>,0.0
2018-04-15,33951,2018-04-15,2509,18793,88430,"Attorney Client privilege is now a thing of the past. I have many (too many!) lawyers and they are probably wondering when their offices, and even homes, are going to be raided with everything, including their phones and computers, taken. All lawyers are deflated and concerned!",-0.8597
2018-04-16,33959,2018-04-16,2510,18191,87657,"Comey drafted the Crooked Hillary exoneration long before he talked to her (lied in Congress to Senator G), then based his decisions on her poll numbers. Disgruntled, he, McCabe, and the others, committed many crimes!",0.3382
2018-04-17,33961,2018-04-17,2511,8736,49949,....Congress <U+2013> House and Senate must quickly pass a legislative fix to ensure violent criminal aliens can be removed from our society. Keep America Safe!,-0.9274
2018-04-18,33970,2018-04-18,2512,7524,38066,. @ FLOTUS Melania and I join the Nation in celebrating the life of Barbara Bush:pic.twitter.comOWiddQx,-0.8996
2018-04-19,33981,2018-04-19,2513,5593,28424,". @ MarshaBlackburn is a wonderful woman who has always been there when we have needed her. Great on the Military, Border Security and Crime. Loves and works hard for the people of Tennessee. She has my full endorsement and I will be there to campaign with her!",-0.9169
2018-04-20,33991,2018-04-20,2514,12250,59185,"Can you believe that despite % bad stories from the Fake News Media (should be getting good stories), today we had just about our highest Poll Numbers, including those on Election Day? The American public is wise to the phony an dishonest press. Make America Great Again!",-0.7697
2018-04-21,34000,2018-04-21,2515,9110,36713,"....it means lying or making up stories. Sorry, I don<U+2019>t see Michael doing that despite the horrible Witch Hunt and the dishonest media!",-0.8824
2018-04-22,34015,2018-04-22,2516,14301,79361,"....We are a long way from conclusion on North Korea, maybe things will work out, and maybe they won<U+2019>t - only time will tell....But the work I am doing now should have been done a long time ago!",-0.75
2018-04-23,34024,2018-04-23,2517,19543,80654,"Despite the Democrat inspired laws on Sanctuary Cities and the Border being so bad and one sided, I have instructed the Secretary of Homeland Security not to let these large Caravans of people into our Country. It is a disgrace. We are the only Country in the World so naive! WALL",-0.899
2018-04-24,34028,2018-04-24,2518,6020,35839,". @ JimRenacci has worked so hard on Tax Reductions, Illegal Immigration, the Border and Crime. I need Jim very badly to help our agenda and to keep MAKING AMERICA GREAT AGAIN! He will be a fantastic Senator for the Great State of Ohio, and has my full endorsement!",0.0
2018-04-25,34035,2018-04-25,2519,10949,66843,". @ FLOTUS did a spectacular job hosting the President of France @ EmmanuelMacron and his wife Brigitte. Every detail was done to perfection. The State Dining Room never looked more beautiful, and Washington is abuzz over what an incredible job Melania did.",0.0
2018-04-27,34041,2018-04-27,2520,9565,44441,"After a furious year of missile launches and Nuclear testing, a historic meeting between North and South Korea is now taking place. Good things are happening, but only time will tell!",-0.9536
2018-04-28,34052,2018-04-28,2521,15957,71232,"....great people of Montana will not stand for this kind of slander when talking of a great human being. Admiral Jackson is the kind of man that those in Montana would most respect and admire, and now, for no reason whatsoever, his reputation has been shattered. Not fair, Tester!",-0.9298
2018-04-29,34059,2018-04-29,2522,7154,46538,"Great evening last night in Washington, Michigan. The enthusiasm, knowledge and love in that room was unreal. To the many thousands of people who couldn<U+2019>t get in, I cherish you....and will be back!",0.3595
2018-04-30,34063,2018-04-30,2523,12707,67180,"<U+201C>Trump<U+2019>s Triumphs are driving his critics Crazy!<U+201D> Thank you Steve Hilton @ NextRevFNC, just want to do what is right for our wonderful U.S.A.",-0.784
2018-05-01,34069,2018-05-01,2524,9302,49709,Congratulations @ ArmyWP_Football!pic.twitter.comrmaLoZMWtK,-0.7901
2018-05-02,34080,2018-05-02,2525,11717,57273,"<U+201C>The questions are an intrusion into the President<U+2019>s Article  powers under the Constitution to fire any Executive Branch Employee...what the President was thinking is an outrageous.....as to the President<U+2019>s unfettered power to fire anyone...<U+201D> Joe Digenova, former US Attorney",-0.7897
2018-05-03,34086,2018-05-03,2526,11532,55854,# NationalDayOfPrayerpic.twitter.comnFUcuyQL,-0.4753
2018-05-04,34096,2018-05-04,2527,5137,29548,"All of us here today are united by the same timeless values. We believe that our liberty is a gift from our creator, and that no Government can ever take it away. We believe in the rule of law - and we support the men and women of law enforcement. We have pride in our history...pic.twitter.comeONjYoju",-0.9515
2018-05-05,34105,2018-05-05,2528,8225,45684,"Great book just out by very successful businessman @ AndyPuzder. Always known as somebody who knows how to win, <U+201C>Capitalist Comeback<U+201D> will be a big hit!",0.4199
2018-05-07,34110,2018-05-07,2529,10080,52723,<U+201C>The Great Revolt<U+201D> by Salena Zito and Brad Todd does much to tell the story of our great Election victory. The Forgotten Men & Women are forgotten no longer!,-0.8061
2018-05-08,34121,2018-05-08,2530,14513,77853,"Gina Haspel, my highly respected nominee to lead the CIA, is being praised for the fact that she has been, and alway will be, TOUGH ON TERROR! This is a woman who has been a leader wherever she has gone. The CIA wants her to lead them into America<U+2019>s bright and glorious future!",-0.3147
2018-05-09,34125,2018-05-09,2531,11609,59714,"Candace Owens of Turning Point USA is having a big impact on politics in our Country. She represents an ever expanding group of very smart <U+201C>thinkers,<U+201D> and it is wonderful to watch and hear the dialogue going on...so good for our Country!",-0.9006
2018-05-10,34132,2018-05-10,2532,15474,86772,Five Most Wanted leaders of ISIS just captured!,-0.9434
2018-05-11,34139,2018-05-11,2533,15195,74372,Thank you Indiana! # MAGA-lKJzOlTj--GHLXYvAnJweonIOEVIcM?t=ms <U+2026>,-0.4574
2018-05-12,34142,2018-05-12,2534,19362,84435,Big week next week when the American Embassy in Israel will be moved to Jerusalem. Congratulations to all!,-0.7644
2018-05-13,34145,2018-05-13,2535,14946,75995,"China and the United States are working well together on trade, but past negotiations have been so one sided in favor of China, for so many years, that it is hard for them to make a deal that benefits both countries. But be cool, it will all work out!",-0.5255
2018-05-14,34151,2018-05-14,2536,10729,56869,# USEmbassyJerusalem ,-0.9317
2018-05-15,34158,2018-05-15,2537,9438,41602,# PeaceOfficersMemorialDaypic.twitter.comagxulpPyag,0.0
2018-05-16,34165,2018-05-16,2538,7219,39691,"...We have not seen China<U+2019>s demands yet, which should be few in that previous U.S. Administrations have done so poorly in negotiating. China has seen our demands. There has been no folding as the media would love people to believe, the meetings...",-0.4003
2018-05-17,34174,2018-05-17,2539,6840,39016,Congrats to the House for passing the VA MISSION Act yesterday. Without this funding our veterans will be forced to stand in never ending lines in order to receive care. Putting politics over our veterans care is UNACCEPTABLE <U+2013> Senate must vote yes on this bill by Memorial Day!,0.0
2018-05-18,34182,2018-05-18,2540,9316,47261,"<U+201C>Apparently the DOJ put a Spy in the Trump Campaign. This has never been done before and by any means necessary, they are out to frame Donald Trump for crimes he didn<U+2019>t commit.<U+201D> David Asman @ LouDobbs @ GreggJarrett Really bad stuff!",-0.9429
2018-05-19,34192,2018-05-19,2541,14909,68953,"America is blessed with extraordinary energy abundance, including more than  years worth of beautiful clean coal. We have ended the war on coal, and will continue to work to promote American energy dominance!",0.75
2018-05-20,34197,2018-05-20,2542,16553,78954,"....At what point does this soon to be $,, Witch Hunt, composed of  Angry and Heavily Conflicted Democrats and two people who have worked for Obama for  years, STOP! They have found no Collussion with Russia, No Obstruction, but they aren<U+2019>t looking at the corruption...",-0.9273
2018-05-21,34205,2018-05-21,2543,9944,51670,"....top of the FBI. Brennan started this entire debacle about President Trump. We now know that Brennan had detailed knowledge of the (phony) Dossier...he knows about the Dossier, he denies knowledge of the Dossier, he briefs the Gang of  on the Hill about the Dossier, which....",-0.7753
2018-05-22,34214,2018-05-22,2544,9220,51296,". @ AsaHutchinson, the great Governor of Arkansas, is in a primary tomorrow. He has done an incredible job with a focus on lower taxes, border security, and crime prevention. Asa loves our military and our veterans. I fully endorse Asa for Governor!",0.8118
2018-05-23,34217,2018-05-23,2545,3960,10078,"...Follow the money! The spy was there early in the campaign and yet never reported Collusion with Russia, because there was no Collusion. He was only there to spy for political reasons and to help Crooked Hillary win - just like they did to Bernie Sanders, who got duped!",-0.92
2018-05-24,34233,2018-05-24,2546,7512,35459,"Clapper has now admitted that there was Spying in my campaign. Large dollars were paid to the Spy, far beyond normal. Starting to look like one of the biggest political scandals in U.S. history. SPYGATE - a terrible thing!",-0.863
2018-05-25,34243,2018-05-25,2547,9383,49277,"<U+201C>Everyone knows there was a Spy, and in fact the people who were involved in the Spying are admitting that there was a Spy...Widespread Spying involving multiple people.<U+201D> Mollie Hemingway, The Federalist Senior Editor But the corrupt Mainstream Media hates this monster story!",-0.6908
2018-05-26,34251,2018-05-26,2548,10277,54010,...but complain and obstruct. They made only bad deals (Iran) and their so-called Trade Deals are the laughing stock of the world!,-0.9355
2018-05-27,34265,2018-05-27,2549,18338,80502,"Fantastic to have , GREAT MEN & WOMEN of Rolling Thunder in D.C. showing their patriotism. They love our Country, they love our Flag, they stand for our National Anthem! Thanks to Executive Director Artie Muller.",-0.7545
2018-05-28,34271,2018-05-28,2550,9401,47501,# MemorialDaypic.twitter.comIohcuhidQ,0.0
2018-05-29,34281,2018-05-29,2551,14438,67240,<U+201C>This investigation involved far more surveillance than we ever had any idea about. It wasn<U+2019>t just a wiretap against a campaign aide...it was secretly gathering information on the Trump Campaign...people call that Spying...this is unprecedented and scandalous.<U+201D> Mollie Hemingway,-0.8774
2018-05-30,34288,2018-05-30,2552,9855,52257,"....There are lots of really good lawyers in the country, he could have picked somebody else!<U+201D> And I wish I did!",-0.883
2018-05-31,34296,2018-05-31,2553,10724,47658,"<U+201C>The recusal of Jeff Sessions was an unforced betrayal of the President of the United States.<U+201D> JOE DIGENOVA, former U.S. Attorney.",-0.6062
2018-06-01,34308,2018-06-01,2554,9734,68783,"A.P. has just reported that the Russian Hoax Investigation has now cost our government over $ million, and going up fast. No Collusion, except by the Democrats!",-0.5562
2018-06-02,34313,2018-06-02,2555,4988,29810,"....<U+201C>$ million spent, it<U+2019>s a scam Investigation. Americans are being worked. We now know there was Russian collusion, with Russians and the Democrats. The Mueller team is stacked with anti-Trumpers, who actually represented Clinton people (& gave $<U+2019>s to Crooked H).<U+201D> Dan Bongino",-0.8959
2018-06-03,34324,2018-06-03,2556,17553,78283,"....Paul Manafort came into the campaign very late and was with us for a short period of time (he represented Ronald Reagan, Bob Dole & many others over the years), but we should have been told that Comey and the boys were doing a number on him, and he wouldn<U+2019>t have been hired!",-0.5792
2018-06-04,34328,2018-06-04,2557,10329,47711,# Days of American Greatness:  pic.twitter.comVCeoTkcI,-0.8442
2018-06-05,34339,2018-06-05,2558,6483,37744,.... @ NASCAR and Champion @ MartinTruex_Jr were recently at the White House. It was a great day for a great sport!,-0.75
2018-06-06,34357,2018-06-06,2559,8084,47042,....The greatest Witch Hunt in political history!,-0.9418
2018-06-07,34372,2018-06-07,2560,8476,37837,"<U+201C>$ billion payoff:  utilities cut rates, credit GOP tax cuts<U+201D>-secrets-billion-payoff--utilities-cut-rates-credit-gop-tax-cuts <U+2026>",-0.9057
2018-06-08,34388,2018-06-08,2561,13304,69496,"Canada charges the U.S. a % tariff on Dairy Products! They didn<U+2019>t tell you that, did they? Not fair to our farmers!",-0.9002
2018-06-09,34396,2018-06-09,2562,9597,41168,". @ G Press Briefing in Charlevoix, Canada, prior to departing for Singapore!_smCLfLAPAmLFkuPgx?t=s <U+2026>",-0.242
2018-06-10,34405,2018-06-10,2563,28098,112382,"Based on Justin<U+2019>s false statements at his news conference, and the fact that Canada is charging massive Tariffs to our U.S. farmers, workers and companies, I have instructed our U.S. Reps not to endorse the Communique as we look at Tariffs on automobiles flooding the U.S. Market!",-0.8158
2018-06-11,34407,2018-06-11,2564,16373,78555,....And add to that the fact that the U.S. pays close to the entire cost of NATO-protecting many of these same countries that rip us off on Trade (they pay only a fraction of the cost-and laugh!). The European Union had a $ Billion Surplus-should pay much more for Military!,-0.8777
2018-06-12,34416,2018-06-12,2565,12737,51706,"...Got along great with Kim Jong-un who wants to see wonderful things for his country. As I said earlier today: Anyone can make war, but only the most courageous can make peace! # SingaporeSummit",-0.8953
2018-06-13,34425,2018-06-13,2566,10355,47231,"...realize the economy is the best it<U+2019>s ever been with employment being at an all time high, and many companies pouring back into our country. Wake up Punchy!",-0.9119
2018-06-14,34443,2018-06-14,2567,13944,68321,"....Schneiderman, who ran the Clinton campaign in New York, never had the guts to bring this ridiculous case, which lingered in their office for almost  years. Now he resigned his office in disgrace, and his disciples brought it when we would not settle.",-0.881
2018-06-15,34450,2018-06-15,2568,11429,59843,<U+201C>Donald Trump was % right to fire James Comey.<U+201D> Mark Levin,-0.4753
2018-06-16,34460,2018-06-16,2569,7783,43185,"Democrats can fix their forced family breakup at the Border by working with Republicans on new legislation, for a change! This is why we need more Republicans elected in November. Democrats are good at only three things, High Taxes, High Crime and Obstruction. Sad!",-0.8065
2018-06-17,34466,2018-06-17,2570,10503,46777,"Chuck Schumer said <U+201C>the Summit was what the Texans call all cattle and no hat.<U+201D> Thank you Chuck, but are you sure you got that right? No more nuclear testing or rockets flying all over the place, blew up launch sites. Hostages already back, hero remains coming home & much more!",-0.9103
2018-06-18,34475,2018-06-18,2571,15849,75586,"<U+201C>The highest level of bias I<U+2019>ve ever witnessed in any law enforcement officer.<U+201D> Trey Gowdy on the FBI<U+2019>s own, Peter Strzok. Also remember that they all worked for Slippery James Comey and that Comey is best friends with Robert Mueller. A really sick deal, isn<U+2019>t it?",-0.9617
2018-06-19,34487,2018-06-19,2572,7281,34792,"# CHANGETHELAWS Now is the best opportunity ever for Congress to change the ridiculous and obsolete laws on immigration. Get it done, always keeping in mind that we must have strong border security.",-0.8398
2018-06-20,34496,2018-06-20,2573,8051,37908,"<U+201C>FBI texts have revealed anti-Trump Bias.<U+201D> @ FoxNews Big News, but the Fake News doesn<U+2019>t want to cover. Total corruption - the Witch Hunt has turned out to be a scam! At some point soon the Mainstream Media will have to cover correctly, too big a story!",-0.9573
2018-06-21,34508,2018-06-21,2574,8083,38887,"<U+201C>I REALLY DON<U+2019>T CARE, DO U?<U+201D> written on the back of Melania<U+2019>s jacket, refers to the Fake News Media. Melania has learned how dishonest they are, and she truly no longer cares!",-0.8716
2018-06-22,34525,2018-06-22,2575,11194,49346,"% of Mexico<U+2019>s Exports come to the United States. They totally rely on us, which is fine with me. They do have, though, very strong Immigration Laws. The U.S. has pathetically weak and ineffective Immigration Laws that the Democrats refuse to help us fix. Will speak to Mexico!",-0.9429
2018-06-23,34538,2018-06-23,2576,6952,34368,". @ FoxNews Poll numbers plummet on the Democrat inspired and paid for Russian Witch Hunt. With all of the bias, lying and hate by the investigators, people want the investigators investigated. Much more will come out. A total scam and excuse for the Dems losing the Election!",-0.9151
2018-06-24,34552,2018-06-24,2577,14526,68728,"....Our Immigration policy, laughed at all over the world, is very unfair to all of those people who have gone through the system legally and are waiting on line for years! Immigration must be based on merit - we need people who will help to Make America Great Again!",-0.9343
2018-06-25,34558,2018-06-25,2578,12480,56527,". @ RepClayHiggins has been a great help to me on Cutting Taxes, creating great new healthcare programs at low cost, fighting for Border Security, our Military and are Vets. He is tough on Crime and has my full Endorsement. The Great State of Louisiana, we want Clay!",-0.7903
2018-06-26,34570,2018-06-26,2579,6763,47988,....We are finishing our study of Tariffs on cars from the E.U. in that they have long taken advantage of the U.S. in the form of Trade Barriers and Tariffs. In the end it will all even out - and it won<U+2019>t take very long!,-0.8765
2018-06-27,34585,2018-06-27,2580,4286,30630,A great First Lady! <U+2026>,-0.8912
2018-06-28,34600,2018-06-28,2581,6768,40882,"....persecuted on old andor totally unrelated charges (there was no collusion and there was no obstruction of the no collusion)...And what is going on in the FBI & DOJ with Crooked Hillary, the DNC and all of the lies? A disgraceful situation!",-0.8964
2018-06-29,34615,2018-06-29,2582,10497,54519,"Before going any further today, I want to address the horrific shooting that took place yesterday at the Capital Gazette newsroom in Annapolis, Maryland. This attack shocked the conscience of our Nation, and filled our hearts with grief...pic.twitter.comLALXGhkb",-0.8591
2018-06-30,34617,2018-06-30,2583,8393,45612,"A friend of mine and a man who has truly seen politics and life as few others ever will, Sean Spicer, has written a great new book, <U+201C>The Briefing: Politics, the Press and the President.<U+201D> It is a story told with both heart and knowledge. Really good, go get it!",-0.8832
2018-07-01,34627,2018-07-01,2584,7020,45698,"A big week, especially with our numerous victories in the Supreme Court. Heading back to the White House now. Focus will be on the selection of a new Supreme Court Justice. Exciting times for our country. Economy may be stronger than it has ever been!",0.0
2018-07-02,34630,2018-07-02,2585,10568,62007,Congratulations to Andres Manuel Lopez Obrador on becoming the next President of Mexico. I look very much forward to working with him. There is much to be done that will benefit both the United States and Mexico!,0.8748
2018-07-03,34632,2018-07-03,2586,7920,47625,"Crazy Maxine Waters, said by some to be one of the most corrupt people in politics, is rapidly becoming, together with Nancy Pelosi, the FACE of the Democrat Party. Her ranting and raving, even referring to herself as a wounded animal, will make people flee the Democrats!",-0.8065
2018-07-04,34644,2018-07-04,2587,8777,44713,"...has endured because of the sweat, blood and sacrifice of the American Armed Forces <U+2013> the greatest force for peace and justice in the history of the world!",0.0
2018-07-05,34652,2018-07-05,2588,8156,42298,".....Country being forced to endure a long and costly trial. Tell the people <U+201C>OUT,<U+201D> and they must leave, just as they would if they were standing on your front lawn. Hiring thousands of <U+201C>judges<U+201D> does not work and is not acceptable - only Country in the World that does this!",-0.7054
2018-07-06,34658,2018-07-06,2589,11885,59556,"A vote for Democrats in November is a vote to let MS- run wild in our communities, to let drugs pour into our cities, and to take jobs and benefits away from hardworking Americans. Democrats want anarchy, amnesty and chaos - Republicans want LAW, ORDER and JUSTICE!",0.0
2018-07-07,34664,2018-07-07,2590,14940,93199,Big decision will soon be made on our next Justice of the Supreme Court!,-0.7901
2018-07-08,34667,2018-07-08,2591,17776,97205,Iranian Harassment of U.S. Warships: :  :  :  :  Source: @ USNavy,-0.8588
2018-07-09,34672,2018-07-09,2592,13754,64508,"...Europe far more than it does the U.S. By some accounts, the U.S. is paying for % of NATO, with many countries nowhere close to their % commitment. On top of this the European Union has a Trade Surplus of $ Million with the U.S., with big Trade Barriers on U.S. goods. NO!",-0.8807
2018-07-10,34678,2018-07-10,2593,8045,45811,"A recent Emerson College ePoll said that most Americans, especially Hispanics, feel that they are better off under President Trump than they were under President Obama.",-0.8122
2018-07-11,34689,2018-07-11,2594,11692,63931,"...things up, better than ever before, but it can<U+2019>t go too quickly. I am fighting for a level playing field for our farmers, and will win!",-0.7096
2018-07-12,34697,2018-07-12,2595,8885,38328,"# NATOSummit Press Conference in Brussels, Belgium:-M?t=s <U+2026>",-0.8713
2018-07-13,34707,2018-07-13,2596,9520,46893,"Congressman Matt Gaetz of Florida is one of the finest and most talented people in Congress. Strong on Crime, the Border, Illegal Immigration, the nd Amendment, our great Military & Vets, Matt worked tirelessly on helping to get our Massive Tax Cuts. He has my Full Endorsement!",0.0
2018-07-14,34710,2018-07-14,2597,10624,52388,"....Remember, it was Little Jeff Z and his people, who are told exactly what to say, who said I could not win the election in that <U+201C>there was no way to <U+201D> (over & over again) in the Electoral College. I got ! They were sooooo wrong in their election coverage. Still hurting!",-0.8923
2018-07-15,34719,2018-07-15,2598,11127,61154,"...know how to do is resist and obstruct! This is why there is such hatred and dissension in our country <U+2013> but at some point, it will heal!",-0.8197
2018-07-16,34724,2018-07-16,2599,9201,47709,"A productive dialogue is not only good for the United States and good for Russia, but it is good for the world. # HELSINKIpic.twitter.comQYPhMau",-0.8703
2018-07-17,34733,2018-07-17,2600,12708,65934,"I had a great meeting with NATO. They have paid $ Billion more and will pay hundreds of Billions of Dollars more in the future, only because of me. NATO was weak, but now it is strong again (bad for Russia). The media only says I was rude to leaders, never mentions the money!",-0.1511
2018-07-18,34738,2018-07-18,2601,10865,58329,". million jobs created since our great Election Victory - far greater than ever anticipated, and only getting better as new and greatly improved Trade Deals start coming to fruition!",-0.8188
2018-07-19,34751,2018-07-19,2602,9530,48379,"....proliferation, cyber attacks, trade, Ukraine, Middle East peace, North Korea and more. There are many answers, some easy and some hard, to these problems...but they can ALL be solved!",-0.9378
