date,new_id,notweets,retweets,favorites,text,ss_min,ss_max,ss_compound,presidency,delta_1day,delta_2day
5/4/2009,1,1,500,868,Be sure to tune in and watch Donald Trump on Late Night with David Letterman as he presents the Top Ten List tonight!,0.5255,0.5255,0.5255,1,1,1
5/5/2009,2,1,33,273,Donald Trump will be appearing on The View tomorrow morning to discuss Celebrity Apprentice and his new book Think Like A Champion!,0.7712,0.7712,0.7712,1,0,1
5/8/2009,3,2,11,18,Donald Trump reads Top Ten Financial Tips on Late Show with David Letterman:  - Very funny!,0,0.6468,0.3234,1,1,1
5/12/2009,4,2,27,26,Miss USA Tara Conner will not be fired - I've always been a believer in second chances. says Donald Trump,0,0.4809,0.24045,1,0,0
5/13/2009,5,1,14,16,"Listen to an interview with Donald Trump discussing his new book, Think Like A Champion: ",0.7506,0.7506,0.7506,1,0,0
5/14/2009,6,1,18,25,Strive for wholeness and keep your sense of wonder intact. --Donald J. Trump ,0.2023,0.2023,0.2023,1,1,0
5/15/2009,7,1,14,8,Enter the Think Like A Champion signed book and keychain contest: ,0.7506,0.7506,0.7506,1,0,0
5/17/2009,8,2,20,48,Don<U+2019>t be afraid of being unique - it's like being afraid of your best self. --Donald J. Trump ,0,0.7717,0.38585,1,,
5/18/2009,9,1,64,102,We win in our lives by having a champion's view of each moment. --Donald J. Trump ,0.5859,0.5859,0.5859,1,1,1
5/19/2009,10,1,18,17,...these days...we could all use a little of the power of Trumpative thinking. <U+2013>BarnesandNoble.com ,0,0,0,1,0,1
5/20/2009,11,1,29,53,Always know you could be on the precipice of something great. --Donald J. Trump ,0.6249,0.6249,0.6249,1,0,0
5/21/2009,12,1,8,10,Read a great interview with Donald Trump that appeared in The New York Times Magazine: ,0.6249,0.6249,0.6249,1,0,0
5/22/2009,13,2,12,4,Don't forget to enter the Think Like A Champion signed book and keychain contest: ,0,0.7944,0.3972,1,0,0
5/23/2009,14,1,54,77,Did you know Donald Trump is on Facebook?  - Become a fan today!,0.3802,0.3802,0.3802,1,,
5/26/2009,15,1,42,73,Your higher self is in direct opposition to your comfort zone. --Donald J. Trump ,0.3612,0.3612,0.3612,1,1,1
5/27/2009,16,1,4,12,Read an excerpt from Think Like A Champion by Donald J. Trump: ,0.7506,0.7506,0.7506,1,0,1
5/28/2009,17,1,61,57,You have to know when to call it quits and when to keep moving forward. --Donald J. Trump ,0,0,0,1,1,0
6/3/2009,18,1,14,20,Check out Donald Trump's new iGoogle Showcase page: ,0,0,0,1,0,0
6/5/2009,19,1,12,31,"<U+201C>If you don't have problems, you're pretending or you don't run your own business.<U+201D> <U+2013>Donald J. Trump ",0.3935,0.3935,0.3935,1,0,1
6/8/2009,20,1,9,3,Last week to enter the Think Like A Champion signed book and keychain contest: ,0.7506,0.7506,0.7506,1,0,0
6/14/2009,21,1,17,16,Today is Donald Trump's Birthday! Send him your B'day wishes here: ,0.2244,0.2244,0.2244,1,,
6/16/2009,22,1,36,36,Thanks to all for your thoughtful birthday wishes <U+2013> Donald Trump,0.7269,0.7269,0.7269,1,0,0
6/18/2009,23,1,18,17,"RE: FB Vanity URLs: SF Chronicle - David Beckham was one of the first, along with Britney Spears & Donald Trump. ",-0.2263,-0.2263,-0.2263,1,1,1
6/21/2009,24,1,62,122,- Wishing a Happy Father's Day to all the Dad's out there - YOU are a champion today and everyday! ,0.8687,0.8687,0.8687,1,,
6/23/2009,25,1,13,10,<U+201C>Expand your life every day.<U+201D> <U+2013>Donald J. Trump ,0,0,0,1,1,0
6/25/2009,26,1,27,15,Donald Trump<U+2019>s commercial-free WWE Raw does big rating: ,0,0,0,1,1,1
6/26/2009,27,1,86,221,RE: Michael Jackson: He was a great friend and a spectacular entertainer. It<U+2019>s a devastating loss! -Donald J. Trump,0.5562,0.5562,0.5562,1,0,1
6/30/2009,28,1,4,7,Watch a powerful and frank interview with Donald Trump about the economy on Greta Van Susteren's On The Record: ,0.4215,0.4215,0.4215,1,0,1
7/5/2009,29,1,25,30,Here's to a safe and happy Independence Day for one and all - Enjoy it! --Donald J. Trump,0.8777,0.8777,0.8777,1,,
7/13/2009,30,1,14,27,Be aware of things that seem inexplicable because they can be a big step towards innovation. --Donald J. Trump ,0.3818,0.3818,0.3818,1,1,1
7/15/2009,31,1,6,6,Donald Trump backs 'Apprentice' Randal Pinkett for N.J. Lieutenant Governor: ,-0.0516,-0.0516,-0.0516,1,1,1
7/22/2009,32,1,9,10,Congrats to winners from around the world who entered the Think Like A Champion signed bookkeychain contest! ,0.9215,0.9215,0.9215,1,0,1
7/28/2009,33,1,30,26,Check out a list of Donald Trump's books for summer reading at the Trump University Blog: ,0,0,0,1,0,1
8/4/2009,34,1,32,18,Browse Donald Trump's Summer Reading List for Business Success at the Trump University Blog: ,0.5719,0.5719,0.5719,1,1,1
8/11/2009,35,1,27,26,Think. That<U+2019>s the first step. Use all your power to utilize and develop that capability --Donald J. Trump ,0,0,0,1,0,0
8/14/2009,36,1,34,35,Ivanka is now on Twitter - You can follow her @ IvankaTrump - Have a terrific weekend!,0.5255,0.5255,0.5255,1,0,0
8/20/2009,37,1,4,8,-- Watch Donald Trump's recent appearance on The Late Show with David Letterman: ,0,0,0,1,1,1
8/21/2009,38,1,15,6,"Watch the Miss Universe competition LIVE from the Bahamas - Sunday,  @pm (ET) on NBC: ",-0.1531,-0.1531,-0.1531,1,1,1
8/23/2009,39,1,10,12,Reminder: The Miss Universe competition will be LIVE from the Bahamas - Tonight @pm (EST) on NBC: ,-0.1531,-0.1531,-0.1531,1,,
8/29/2009,40,1,264,373,- Donald Trump bids to buy the Oreo Double Stuf Racing League. Check it out: ,0,0,0,1,,
9/1/2009,41,1,56,58,- More hysterical DSRL videos featuring Donald Trump and Double Trump plus enter Golden Lick Race Sweepstakes: ,-0.101,-0.101,-0.101,1,0,0
9/14/2009,42,1,29,36,Read Donald Trump's Top Ten Tips for Success: ,0.6705,0.6705,0.6705,1,1,1
9/29/2009,43,1,58,80,"A lot of people have imagination, but can't execute--you have to execute with the imagination. --Donald J. Trump ",0,0,0,1,0,1
10/5/2009,44,1,8,8,"- Read what Donald Trump has to say about daughter Ivanka's upcoming new book, The Trump Card: ",0,0,0,1,1,1
10/14/2009,45,1,11,10,Watch video of Ivanka Trump sharing business advice with  entrepreneurial women on GMA: ,0.4215,0.4215,0.4215,1,1,1
10/22/2009,46,1,6,5,"Hear Donald Trump discuss big gov spending, banks, & taxes on Your World wNeil Cavuto: ",0,0,0,1,1,1
10/27/2009,47,1,8,11,#NAME?,0.807,0.807,0.807,1,0,0
11/2/2009,48,1,12,10,#NAME?,0.6369,0.6369,0.6369,1,1,0
11/16/2009,49,1,16,5,"Donald Trump Partners with TV on New Reality Series Entitled, Omarosa's Ultimate Merger: ",0.2732,0.2732,0.2732,1,1,1
11/26/2009,50,1,221,573,Wishing you and yours a very Happy and Bountiful Thanksgiving!,0.7339,0.7339,0.7339,1,,
12/3/2009,51,1,40,8,Trump International Tower in Chicago ranked th tallest building in world by Council on Tall Buildings & Urban Habitat ,0,0,0,1,0,0
12/23/2009,52,1,226,233,"From Donald Trump: Wishing everyone a wonderful holiday & a happy, healthy, prosperous New Year. Let<U+2019>s think like champions in !",0.9719,0.9719,0.9719,1,1,1
1/12/2010,53,1,29,9,"Celebrity Apprentice returns to NBC, Sunday, , -PM ETPT. Outstanding list of celebrities & season should be the best one yet!",0.8588,0.8588,0.8588,1,0,0
1/15/2010,54,1,262,305,Trump Tycoon App for iPhone & iPod Touch - It's $. but the advice is priceless! ,0,0,0,1,0,0
1/21/2010,55,1,8957,8117,from Donald Trump: I saw Lady Gaga last night and she was fantastic!,0.5983,0.5983,0.5983,1,0,0
1/22/2010,56,1,18,3,"Golf Channel & Donald Trump's World of Golf host a Celebrity Match  @TNGC LA, CA - Mark Wahlberg vs. Kevin Dillon ",0,0,0,1,0,0
2/7/2010,57,1,31,21,"Superbowl Sunday is a great American tradition. The Colts and Saints are already champions, but may the best team win!",0.952,0.952,0.952,1,,
2/10/2010,58,1,12,5,Donald Trump appearing today on CNN International<U+2019>s <U+2018>Connect the World<U+2019> as <U+2018>Connector of the Day<U+2019>. Submit questions: ,0,0,0,1,0,1
2/11/2010,59,1,19,4,Donald Trump appeared on the final episode of The Jay Leno Show to deliver a very special message: ,0.4576,0.4576,0.4576,1,1,1
2/26/2010,60,1,28,23,"From Donald Trump: <U+201C>I<U+2019>m so proud of my wife Melania and the launch of her new jewelry line, to debut on QVC on April th at  p.m.<U+201D>",0.6113,0.6113,0.6113,1,1,0
3/5/2010,61,1,11,10,From Donald Trump: Andrea Bocelli @Mar-a-Lago - Many say best night of entertainment in long history of Palm Beach ,0.7906,0.7906,0.7906,1,1,1
3/12/2010,62,1,25,9,"The Celebrity Apprentice has a two-hour premiere this Sunday, March th, at  p.m. on NBC. This will be the best season yet, see you then!",0.6696,0.6696,0.6696,1,0,1
3/15/2010,63,1,27,7,The new season of the Celebrity Apprentice is off to a great start-- last night it swept the  p.m. hour in every key demographic.,0.6249,0.6249,0.6249,1,1,1
3/17/2010,64,1,17,8,Olympic Gold Medalist Evan Lysacek just left my office. He is in town and wanted to meet me--he's a fanastic guy and a true champion.,0.7717,0.7717,0.7717,1,1,1
3/18/2010,65,1,47,15,I am happy to announce that theoriginal Apprentice --which will offer job opportunities to those in need--is coming back.,0.743,0.743,0.743,1,0,1
3/19/2010,66,1,14,3,Last week's episode of the Celebrity Apprentice set the stage for a great new season. Tune in this Sunday on NBC for even more excitement.,0.8221,0.8221,0.8221,1,0,0
3/23/2010,67,1,19,11,"The Trump Hotel Collection is currently nominated for Conde Nast Traveler Readers Choice Awards, Travel & Leisure and World Travel Awards.",0.7184,0.7184,0.7184,1,1,1
3/24/2010,68,1,49,17,The original Apprentice is coming back--do you have what it takes to be the next Apprentice? For casting details: ,0.3182,0.3182,0.3182,1,0,1
3/29/2010,69,1,32,34,"The NYC casting call for The Apprentice is thisThursday, April  at Trump Tower. For all the information you need, go to NBC.comcasting.",0,0,0,1,1,1
3/31/2010,70,1,23,7,Don't forget the open call at Trump Tower tomorrow for The Apprentice. I look forward to seeing you there.,0.1695,0.1695,0.1695,1,0,0
4/1/2010,71,1,11,5,"Today's open call drew thousands of eager applicants. It was an impressive group, I enjoyed meeting them. We've got some great candidates!",0.9259,0.9259,0.9259,1,1,1
4/6/2010,72,3,5,5,"Last night Melania and I attended the Skating with the Stars Gala at Wollman Rink in Central Park, it was fantastic. Stay tuned for Part ..",0.3818,0.9451,0.6281,1,1,1
4/7/2010,73,1,15,4,Trump SoHo opens this Friday and it is fantastic! Check out the Trump Hotel Collection... ,0.5983,0.5983,0.5983,1,0,0
4/9/2010,74,1,14,9,This is a terrific day for downtown New York. Trump SoHo is unlike anything else. Be sure to visit this fantastic hotel soon!,0.8733,0.8733,0.8733,1,1,1
4/12/2010,75,1,17,7,The premiere of Donald J. Trump's Fabulous World of Golf is tomorrow night at  p.m. ET on Golf Channel. Tune in for a great adventure!,0.8777,0.8777,0.8777,1,1,1
4/13/2010,76,1,94,46,Looking forward to seeing the World Champion Yankees today on opening day!,0.636,0.636,0.636,1,1,1
4/14/2010,77,1,34,19,"Before Kids Can Go Places, They Need a Place To Go -- the motto of The Police Athletic League, an organization I'm very proud to support",0.7474,0.7474,0.7474,1,1,1
4/16/2010,78,1,17,9,"On Sunday, Jerome Bettis 'the bus' from the Pittsburgh Steelers will play at Trump Int'l Golf ClubPalm Beach against Julius Erving 'Dr J'",0.34,0.34,0.34,1,0,0
4/20/2010,79,1,133,133,Tune in to The Marriage Ref onThursday night at  p.m. on NBC--I'm on the panel of experts along with Gloria Estefan & Adam Carolla.,0,0,0,1,1,1
4/21/2010,80,1,3321,5260,Melania and I saw American Idiot on Broadway last night and it was great. An amazing theatrical experience!,0.7088,0.7088,0.7088,1,0,1
4/22/2010,81,1,24,7,Melania and I will be appearing on The View tomorrow at  a.m. on CBS. Tune in for some great fun!,0.8268,0.8268,0.8268,1,1,1
4/23/2010,82,1,29,4,"To put on your calendar for May: Miss USA , live from Las Vegas on May th,  p.m. ET on NBC. I'll be there--tune in for a great show!",0.5848,0.5848,0.5848,1,1,1
4/26/2010,83,1,68,16,Our thoughts and prayers remain with Bret Michaels and his family and for his speedy recovery.,0,0,0,1,0,1
4/28/2010,84,1,16,11,"Melania and I will be appearing on Larry King Live tonight,  p.m. on CNN. Be sure to tune in for some great conversation!",0.7712,0.7712,0.7712,1,1,0
4/29/2010,85,1,31,16,Melania will be on QVC tomorrow night at  p.m. ET to introduce her beautiful and inspiring Melania Timepieces & Fashion Jewelry collection.,0.7717,0.7717,0.7717,1,1,1
4/30/2010,86,1,20,8,Be sure to look for my beautiful wife Melania Trump tonight on QVC at  pm ET where she will be debuting her fantastic jewelry collection.,0.8689,0.8689,0.8689,1,0,0
5/3/2010,87,3,8,5,Also appearing on the Miss USA Pageant will be Country Superstar Trace Adkins and Pop Rock Sensation Boys Like Girls...,-0.1531,0.7177,0.263633333,1,1,0
5/5/2010,88,1,43,11,We're all very happy to hear of Bret Michael's progress and send our best wishes for his full recovery.,0.9117,0.9117,0.9117,1,0,0
5/13/2010,89,1,22,7,"Looking forward to the  Miss USA Pageant, Sunday May  on NBC,  p.m. ET, hosted by Curtis Stone & Natalie Morales live from Las Vegas.",-0.1531,-0.1531,-0.1531,1,0,1
5/17/2010,90,1,105,167,"Congratulations to our new Miss USA, the beautiful Rima Fakih. Rima will represent us well at Miss Universe and be a wonderful Miss USA .",0.8957,0.8957,0.8957,1,1,0
5/19/2010,91,1,22,6,Put this on your calendar: The Celebrity Apprentice live finale is this Sunday at  p.m. on NBC. Who will be the next Celebrity Apprentice?,0,0,0,1,0,0
5/20/2010,92,2,23,6,"Check out Ivanka's new FaceBook page and keep up with what's happening--from The Celebrity Apprentice, to jewlery to free tickets and more..",0,0.5106,0.2553,1,0,0
5/21/2010,93,1,18,21,Who's your pick-- @ bretmichaels or @ hollyrpeete ? Vote now on Ivanka's new Facebook page! ,0,0,0,1,1,0
5/24/2010,94,1,57,20,"Congratulations to Bret Michaels, the new Celebrity Apprentice. Bret's a true champion, all of us were happy to see him and to see him win!",0.9606,0.9606,0.9606,1,0,1
5/25/2010,95,2,14,7,Ivanka caught up with Bret and Holly backstage. Both Bret and Holly were champions all the way. ,0.5267,0.9381,0.7324,1,1,0
5/26/2010,96,2,16,8,"Scotland is beautiful. I spent several years looking for the right place, visiting over  sites, and this is absolutely the right place!",0.5574,0.636,0.5967,1,0,0
5/27/2010,97,1,672,1707,"The Dunes here are amazing, and they're how I learned about geomorphology, which is the study of movement landforms. We've had a great trip",0.836,0.836,0.836,1,1,1
5/28/2010,98,1,52,32,"Wishing everyone a Happy Memorial Day Weekend, with a special thought for all the veterans who have done so much for our freedom.",0.91,0.91,0.91,1,0,1
6/2/2010,99,1,29,10,I'll be turning the table on Larry King this Saturday night. I'll be interviewing him in honor of the th Anniversary of his show.,0.4939,0.4939,0.4939,1,1,1
6/4/2010,100,2,12,3,"Be sure to watch the Larry King Show tomorrow night on CNN,  p.m. I'll be the host, Larry the guest. ",0.3182,0.8271,0.57265,1,0,0
6/6/2010,101,1,33,7,Tonight I trade places with Larry King @ kingsthings and interview him on the th anniversary of his show. PM on CNN featuring best clips.,0.6369,0.6369,0.6369,1,,
6/8/2010,102,1,15,11,I am honored to be chosen by Gray Line for their NY Ride of Fame Campaign. Today we had the ribbon cutting ceremony in front of Trump Tower.,0.7351,0.7351,0.7351,1,1,0
6/9/2010,103,2,10,4,Check out Gray Line's site for the Donald Trump Ride of Fame... ,0,0.7351,0.36755,1,0,1
6/10/2010,104,1,12,5,WSJ covers Ride of Fame ?mod=WSJ_NY_RealEstate_MIDDLE_LSMini,0.4404,0.4404,0.4404,1,1,1
6/15/2010,105,2,14,6,And Trump SoHo New York is one of the hottest new hotels anywhere.... _CollectionTrump_SoHoTrump_SoHo.asp,0,0.5574,0.2787,1,1,1
6/17/2010,106,2,21,7,The Ultimate Merger: --_omarosa_is_back_and_this_time_its_personal.html,0,0.5267,0.26335,1,1,1
6/21/2010,107,2,16,4,"For more information on tonight's two hour telethon,  to  p.m.: ",0,0.6597,0.32985,1,0,0
6/22/2010,108,1,23,8,Great job on the Larry King Live Gulf Telethon last night--$. million was raised in  hours.,0.6249,0.6249,0.6249,1,0,0
6/24/2010,109,1,52,37,"The Eric Trump Foundation has raised over $,, towards St. Jude Children's Research Hospital. ",0,0,0,1,0,0
6/28/2010,110,1,26,10,Trading Shots with Donald Trump--a great article in the Wall Street Journal ,0.6249,0.6249,0.6249,1,0,1
7/1/2010,111,1,23,9,Work is expected to begin today on my golf course in Scotland. It will be spectacular! ,0,0,0,1,0,0
7/2/2010,112,2,35,15,"Due to popular demand, CNN will re-broadcast the Larry King Live show I hosted in June, in which I interview Larry. Monday July ,  pm CNN",0.3182,0.8519,0.58505,1,0,0
7/6/2010,113,1,46,6,The new edition of The Apprentice will be on Thursdays this fall at  pm ET---I'm putting people back to work!,0,0,0,1,1,1
7/14/2010,114,1,92,54,George Steinbrenner was a great friend and a true legend. There will never be anyone like him in New York. We've lost a truly great man.,0.9286,0.9286,0.9286,1,0,1
7/19/2010,115,3,10,2,Visited some very beautiful golf courses this weekend...this is one..._ClubsHudson_ValleyHudson_Valley.asp,0,0.6361,0.212033333,1,1,0
7/20/2010,116,1,77,15,"I'm proud to accept the  HollyRod Foundation Humanitarian Award from Holly Robinson Peete, who raised $, on Celebrity Apprentice",0.8481,0.8481,0.8481,1,1,1
7/29/2010,117,3,20,5,Could this be my newest apprentice?  ...Enter the contest .. .,0,0.7184,0.425266667,1,0,0
7/30/2010,118,1,28,6,Enter the contest.... stay at Trump International Hotel Las Vegas,0,0,0,1,1,0
8/4/2010,119,2,34,7,"Performing live on the Miss Universe Pageant from the Mandalay Bay Resort & Casino will be Telemundo, Orianthi, John Legend and The Roots.",-0.1531,-0.1531,-0.1531,1,1,1
8/9/2010,120,1,43,7,Mark your calenders for August rd: ,0,0,0,1,1,1
8/12/2010,121,7,11,3,Check out the last webisode in our  part series featuring me with Serta. Which one was your favorite? www.youtube.comusermattressserta,0,0.5859,0.258228571,1,0,0
8/19/2010,122,2,46,7,Four more days until the Miss Universe Pageant. Be sure to tune in on Monday night at  p.m. on NBC--it will be an amazing show.,0.6705,0.7345,0.7025,1,0,0
8/23/2010,123,1,53,5,It's going to get hotter in Las Vegas tonight! Watch the Miss Universe Pageant tonight on NBC at  p.m. I'm looking forward to being there!,-0.2924,-0.2924,-0.2924,1,0,0
8/24/2010,124,1,204,86,"Congratulations to Miss Mexico, Jimena Navarrete, our new Miss Universe , and congratulations to everyone for a fantastic show.",0.8807,0.8807,0.8807,1,0,0
8/26/2010,125,1,44,13,The Miss Universe Pageant raked in some great ratings! A great job by everyone.,0.8356,0.8356,0.8356,1,0,0
8/30/2010,126,1,22,12,Spent a beautiful weekend golfing at Trump National Golf Club Westchester and Trump National Golf Club Bedminster.,0.5994,0.5994,0.5994,1,0,1
8/31/2010,127,1,113,113,Went to the Yankees game last night with Bill O'Reilly--we had a great time watching the Yankees win!,0.8478,0.8478,0.8478,1,1,0
9/1/2010,128,1,49,7,I'll be on The Late Show with David Letterman tonight--be sure to tune in for a great show. : pm on CBS.,0.7506,0.7506,0.7506,1,1,1
9/2/2010,129,2,27,10,Check out Serta's Counting Sheep (and me) at the Trump International Hotel New York ,0,0,0,1,1,1
9/7/2010,130,2,15,9,I was invited by Caroline Wozniacki to sit with her family in her special box during her match at the U.S. Open yesterday. She's fantastic!,0,0.7644,0.3822,1,0,1
9/9/2010,131,1,37,12,"Coming up soon: The two hour premiere of The Apprentice. Next Thursday, September th, at  pm on NBC. ",0,0,0,1,1,1
9/14/2010,132,1,54,17,I am very happy to have the civilian version of The Apprentice back on the air this fall. There will be excitement as well as opportunity.,0.902,0.902,0.902,1,0,1
9/15/2010,133,1,21,10,Eric did a great job with his Eric Trump Foundation annual charity outing. I'm proud of him. ,0.875,0.875,0.875,1,1,1
9/16/2010,134,1,64,12,Don't forget to tune in tonight for the two hour premiere of The Apprentice.  pm EST on NBC. We're all in for a fantastic new season!,0.6765,0.6765,0.6765,1,0,1
9/17/2010,135,1,35,21,"Be sure to tune in for Melania's second QVC show for Melania Timepieces & Jewelry tonight, live from - pm on QVC ",0.3182,0.3182,0.3182,1,1,1
9/23/2010,136,1,47,9,Don't forget to tune in tonight at  p.m. on NBC for another action packed episode of The Apprentice. ,0.1695,0.1695,0.1695,1,0,0
9/24/2010,137,1,40,15,See the new sizzle reel for The Apprentice ,0,0,0,1,1,1
9/30/2010,138,1,113,161,Tune in tonight at  pm on NBC for another exciting episode of The Apprentice -- and see the Dog Whisperer make an appearance.,0.4939,0.4939,0.4939,1,0,0
10/1/2010,139,1,18,11,Read Ivanka's blog about last night's Apprentice on Entertainment Weekly ...,0.4215,0.4215,0.4215,1,1,1
10/6/2010,140,1,42,10,"I'm honored to be presented the award of Doctor of Business Administration Honoris Causa from Robert Gordon University in Aberdeen, Scotland",0.8074,0.8074,0.8074,1,0,1
10/7/2010,141,2,26,7,Don't forget to tune in tonight for another exciting episode of The Apprentice-- p.m. on NBC.,0.5948,0.8658,0.7303,1,0,0
10/14/2010,142,2,40,9,"An HR solutions company polled , employed adults to find out who would make ideal bosses... ",0.5037,0.6249,0.5643,1,0,1
10/21/2010,143,1,36,5,Don't forget to tune in tonight to see another unpredictable and exciting episode of The Apprentice--  pm on NBC,0.5948,0.5948,0.5948,1,1,1
10/27/2010,144,1,43,7,"Be prepared for a sensational episode of The Apprentice tomorrow night,  pm on NBC.",0.2263,0.2263,0.2263,1,0,0
10/28/2010,145,1,39,6,"I was on The View this morning. We talked about The Apprentice. Tonight's episode is a great one--tough, exciting and surprising.  pmNBC",0.8555,0.8555,0.8555,1,1,0
11/3/2010,146,1,38,7,"I'll be discussing a variety of topics tonight with Greta Van Susteren,  p.m. on Fox News. It will be the first of a two part series.",0,0,0,1,1,1
11/4/2010,147,1,39,16,Tonight's episode of The Apprentice is one you won't want to miss! Be sure to tune in-- p.m. on NBC.,0.4242,0.4242,0.4242,1,1,1
11/11/2010,148,1,29,5,Tonight's episode of The Apprentice has a big surprise at the top of the show -- don't miss it!  p.m. on NBC.,0.5627,0.5627,0.5627,1,0,1
11/15/2010,149,1,39,18,My interview last week with Greta van Susteren is available here in slightly abridged form.  Good info to know about.,0.3892,0.3892,0.3892,1,0,0
11/18/2010,150,2,29,9,"CNBC Titans: Donald Trump  will be shown Friday Nov th at  pm and  am, Sunday  at  pm and  at  pm ",0,0.6588,0.3294,1,1,1
11/22/2010,151,1,29,15,Staff Sgt. Salvatore A. Giunta received the Medal of Honor from Pres. Obama this month. It was a great honor to have him visit me today.,0.9274,0.9274,0.9274,1,0,1
11/24/2010,152,3,34,15,My best wishes to everyone for a Happy Thanksgiving!,0.4019,0.8687,0.588166667,1,1,1
11/29/2010,153,1,34,8,"Congratulations to Evan Lysacek for being nominated SI sportsman of the year. He's a great guy, and he has my vote! # EvanForSI",0.8516,0.8516,0.8516,1,0,0
12/2/2010,154,1,33,8,"Tonight's episode of The Apprentice is one of the best ever--we're down to the final , and it's high excitement all the way.  pm on NBC.",0.8126,0.8126,0.8126,1,1,1
12/9/2010,155,1,59,11,"Tonight is the Apprentice finale---and it's a fantastic episode in every way, with the great Liza Minnelli performing and a new Apprentice!",0.8398,0.8398,0.8398,1,1,1
12/10/2010,156,1,49,16,Congratulations to Brandy as our new Apprentice and to Clint for being a great player. It's been a terrific season!,0.908,0.908,0.908,1,1,1
12/13/2010,157,3,19,10,"...Trump International Hotel Las Vegas, and Trump International Hotel & Tower Waikiki Beach Walk. ",0,0.802,0.267333333,1,1,1
12/14/2010,158,1,247,39,"I'll be appearing on Larry King Live for his final show, Thursday night at  p.m., CNN. Larry's been on TV for  years...",0,0,0,1,1,1
12/16/2010,159,1,112,22,"Don't forget to watch Larry King tonight, CNN at  pm. He's a television legend and a great friend. It's going to be a fantastic farewell.",0.9112,0.9112,0.9112,1,1,1
12/23/2010,160,1,8121,7614,Wishing everyone a very Happy Holiday season!,0.8467,0.8467,0.8467,1,0,1
12/30/2010,161,1,211,189,"WIshing everyone a happy, healthy and prosperous New Year!",0.8932,0.8932,0.8932,1,0,0
1/12/2011,162,2,45,21,"This afternoon I'll be speaking with Neil Cavuto on Your World with Neil Cavuto,  p.m. on FOX News.",0,0,0,1,1,1
1/13/2011,163,1,185,39,"Don't forget to watch me tonight on Late Night with Jimmy Fallon, : a.m. on NBC. I'll be making a big announcement!",0.2401,0.2401,0.2401,1,0,1
1/21/2011,164,2,48,11,"Busy doing phoners this week with Neil Cavuto, Wolf Blitzer, Fox & Friends, and Larry Kudlow....check out ",-0.3252,0.4767,0.07575,1,1,1
1/27/2011,165,2,77,25,...when they have no environmental restrictions! America' s workers need us. ,-0.3595,0,-0.17975,1,1,1
1/31/2011,166,2,18,9,Don't miss my Fabulous World of Golf now in its second season on Golf Channel beginning tonight at  pm ET ,-0.3252,0,-0.1626,1,1,0
2/7/2011,167,1,70,31,"Be sure to watch Oprah today ( pm on Channel ), I'll be on with my entire family and it will be an entertaining hour..",0.6369,0.6369,0.6369,1,1,1
2/10/2011,168,1,110,309,It was great to appear on Piers Morgan Tonight last night as his first live guest. Piers won the Celebrity Apprentice and he's fantastic.,0.9081,0.9081,0.9081,1,1,0
2/11/2011,169,1,106,50,Watch my speech at CPAC in Washington DC yesterday ...?v=PRbyKxcAo,0,0,0,1,1,1
2/15/2011,170,3,30,13,Check out ShouldTrumpRun....,0,0,0,1,0,0
2/16/2011,171,2,26,15,From The Desk Of Donald Trump- two new videos up at  and ,0,0.8977,0.44885,1,1,1
2/17/2011,172,2,27,10,I was speaking with Don Imus this morning.... ,0,0,0,1,1,1
2/18/2011,173,1,77,27,Check out my interview from MSNBC at ,0,0,0,1,1,1
