date,new_id,notweets,retweets,favorites,text,ss_min,ss_max,ss_compound,presidency,delta_1day,delta_2day
1/22/2018,2428,4,18087,82388,Democrats have shut down our government in the interests of their far left base. They don<U+2019>t want to do it but are powerless!,-0.6049,0.6793,0.18315,3,1,1
1/23/2018,2429,5,18146,87002,"Big win for Republicans as Democrats cave on Shutdown. Now I want a big win for everyone, including Republicans, Democrats and DACA, but especially for our Great Military and Border Security. Should be able to get there. See you at the negotiating table!",0.7177,0.968,0.8522,3,1,1
1/24/2018,2430,5,14278,70959,"Cryin<U+2019> Chuck Schumer fully understands, especially after his humiliating defeat, that if there is no Wall, there is no DACA. We must have safety and security, together with a strong Military, for our great people!",-0.5986,0.9738,0.18548,3,0,1
1/25/2018,2431,4,12806,65357,"Great bilateral meeting with Prime Minister Theresa May of the United Kingdom, affirming the special relationship and our commitment to work together on key national security challenges and economic opportunities. # WEFpic.twitter.comFPPaRDAyt",0,0.9477,0.583575,3,1,1
1/26/2018,2432,6,5450,32649,DACA has been made increasingly difficult by the fact that Cryin<U+2019> Chuck Schumer took such a beating over the shutdown that he is unable to act on immigration!,-0.6996,0.9508,0.447016667,3,1,1
1/27/2018,2433,4,13727,64251,"On Holocaust Remembrance Day we mourn and grieve the murder of  million innocent Jewish men, women and children, and the millions of others who perished in the evil Nazi Genocide. We pledge with all of our might and resolve: Never Again!  pic.twitter.comWSZHTOu",-0.8955,0.8692,0.40465,3,,
1/28/2018,2434,4,30099,140161,Democrats are not interested in Border Safety & Security or in the funding and rebuilding of our Military. They are only interested in Obstruction!,-0.6399,0.2481,-0.104225,3,,
1/29/2018,2435,1,13389,75170,"Congratulations to America<U+2019>s new Secretary of @ HHSGov, Alex Azar!pic.twitter.comYinQaCto",0.636,0.636,0.636,3,0,1
1/31/2018,2436,1,18309,97873,Join me live for the # SOTU,0.296,0.296,0.296,3,1,0
2/1/2018,2437,3,24126,110126,"Heading to beautiful West Virginia to be with great members of the Republican Party. Will be planning Infrastructure and discussing Immigration and DACA, not easy when we have no support from the Democrats. NOT ONE DEM VOTED FOR OUR TAX CUT BILL! Need more Republicans in <U+2018>.",-0.636,0.8221,0.330333333,3,0,0
2/2/2018,2438,6,12229,63118,<U+201C>Trump the orator outlines the greatness of America to Democrats<U+2019> disgust<U+201D>-trump-highlights-americas-freedom <U+2026>,0,0.906,0.598716667,3,0,0
2/3/2018,2439,2,29284,124918,"Rasmussen just announced that my approval rating jumped to %, a far better number than I had in winning the Election, and higher than certain <U+201C>sacred cows.<U+201D> Other Trump polls are way up also. So why does the media refuse to write this? Oh well, someday!",-0.7579,0.8999,0.071,3,,
2/4/2018,2440,4,19507,115655,"...a tool of anti-Trump political actors. This is unacceptable in a democracy and ought to alarm anyone who wants the FBI to be a nonpartisan enforcer of the law....The FBI wasn<U+2019>t straight with Congress, as it hid most of these facts from investigators.<U+201D> Wall Street Journal",-0.765,0.4926,-0.313,3,,
2/5/2018,2441,7,19157,94848,Any deal on DACA that does not include STRONG border security and the desperately needed WALL is a total waste of time. March th is rapidly approaching and the Dems seem not to care about DACA. Make a deal!,-0.8619,0.9215,0.034385714,3,0,0
2/6/2018,2442,5,15517,67822,"My prayers and best wishes are with the family of Edwin Jackson, a wonderful young man whose life was so senselessly taken. @ Colts",-0.9151,0.8591,-0.17774,3,1,0
2/7/2018,2443,7,10805,58388,Best wishes to the Republic of Korea on hosting the @ Olympics! What a wonderful opportunity to show everyone that you are a truly GREAT NATION!pic.twitter.comaboMUpy,0,0.9666,0.7507,3,0,1
2/8/2018,2444,4,11538,71733,"As long as we open our eyes to God<U+2019>s grace - and open our hearts to God<U+2019>s love - then America will forever be the land of the free, the home of the brave, and a light unto all nations. # NationalPrayerBreakfastpic.twitter.comcwxsluK",0,0.9359,0.5731,3,0,0
2/9/2018,2445,5,18166,79815,"Costs on non-military lines will never come down if we do not elect more Republicans in the  Election, and beyond. This Bill is a BIG VICTORY for our Military, but much waste in order to get Dem votes. Fortunately, DACA not included in this Bill, negotiations to start now!",-0.6114,0.7959,0.18098,3,1,0
2/10/2018,2446,8,11572,57598,"....agencies, not just the FBI & DOJ, now the State Department to dig up dirt on him in the days leading up to the Election. Comey had conversations with Donald Trump, which I don<U+2019>t believe were accurate...he leaked information (corrupt).<U+201D> Tom Fitton of Judicial Watch on @ FoxNews",-0.8442,0.4926,-0.2911875,3,,
2/11/2018,2447,5,12592,69362,. million hard working Americans have already received a large Bonus andor Pay Increase because of our recently Passed Tax Cut & Jobs Bill....and it will only get better! We are far ahead of schedule.,-0.4226,0.9761,0.37132,3,,
2/12/2018,2448,3,11948,60092,"Thank you to Sue Kruczek, who lost her wonderful and talented son Nick to the Opioid scourge, for your kind words while on @ foxandfriends. We are fighting this terrible epidemic hard - Nick will not have died in vain!",-0.632,0.8439,0.2938,3,1,1
2/13/2018,2449,2,19076,94949,"Negotiations on DACA have begun. Republicans want to make a deal and Democrats say they want to make a deal. Wouldn<U+2019>t it be great if we could finally, after so many years, solve the DACA puzzle. This will be our last chance, there will never be another opportunity! March th.",0.7733,0.8074,0.79035,3,1,1
2/14/2018,2450,4,9610,50458,"As we come together to celebrate the extraordinary contributions of African-Americans to our nation, our thoughts turn to the heroes of the civil rights movement whose courage and sacrifice have inspired us all. Proclamation:  pic.twitter.comNxAEKZyp",-0.765,0.9246,0.129725,3,1,1
2/15/2018,2451,6,11494,53863,"...lottery, continues deadly catch-and-release, and bars enforcement even for FUTURE illegal immigrants. Voting for this amendment would be a vote AGAINST law enforcement, and a vote FOR open borders. If Dems are actually serious about DACA, they should support the Grassley bill!",-0.8777,0.8832,-0.336766667,3,1,1
2/16/2018,2452,3,17031,87138,Cannot believe how BADLY DACA recipients have been treated by the Democrats...totally abandoned! Republicans are still working hard.,-0.533,0.5767,-0.0361,3,1,1
2/17/2018,2453,6,12451,51599,"<U+201C>Charges Deal Don A Big Win,<U+201D> written by Michael Goodwin of the @ nypost, succinctly states that <U+201C>the Russians had no impact on the election results.<U+201D> There was no Collusion with the Trump Campaign. <U+201C>She lost the old-fashioned way, by being a terrible candidate. Case closed.<U+201D>",-0.8573,0.8208,-0.180783333,3,,
2/18/2018,2454,11,13151,69107,"Finally, Liddle<U+2019> Adam Schiff, the leakin<U+2019> monster of no control, is now blaming the Obama Administration for Russian meddling in the  Election. He is finally right about something. Obama was President, knew of the threat, and did nothing. Thank you Adam!",-0.8807,0.9245,0.180090909,3,,
2/19/2018,2455,3,18896,81570,"Have a great, but very reflective, President<U+2019>s Day!",-0.2714,0.4295,0.0527,3,,
2/20/2018,2456,13,7972,46178,". @ MittRomney has announced he is running for the Senate from the wonderful State of Utah. He will make a great Senator and worthy successor to @ OrrinHatch, and has my full support and endorsement!",-0.7522,0.9508,0.513338462,3,0,0
2/21/2018,2457,7,12898,67083,". @ FLOTUS Melania and I join millions of people around the world in mourning the passing of Billy Graham. Our prayers are with his children, grandchildren, great-grandchildren and all who worked closely with Reverend Graham in his lifelong ministry.",-0.7602,0.9633,0.275085714,3,0,0
2/22/2018,2458,10,15551,74933,"....History shows that a school shooting lasts, on average,  minutes. It takes police & first responders approximately  to  minutes to get to site of crime. Highly trained, gun adept, teacherscoaches would solve the problem instantly, before police arrive. GREAT DETERRENT!",-0.9364,0.9581,0.42579,3,1,0
2/23/2018,2459,10,6449,41555,"<U+201C>School shooting survivor says he quit @ CNN Town Hall after refusing scripted question.<U+201D> @ TuckerCarlson. Just like so much of CNN, Fake News. That<U+2019>s why their ratings are so bad! MSNBC may be worse.",-0.8652,0.9363,0.25605,3,1,1
2/24/2018,2460,6,13528,66781,Armed Educators (and trusted people who work within a school) love our students and will protect them. Very smart people. Must be firearms adept & have annual training. Should get yearly bonus. Shootings will not happen again - a big & very inexpensive deterrent. Up to States.,-0.8932,0.9468,0.296966667,3,,
2/25/2018,2461,5,7216,44600,"<U+201C>Congressman Schiff omitted and distorted key facts<U+201D> @ FoxNews So, what else is new. He is a total phony!",-0.9161,0.6239,-0.20612,3,,
2/27/2018,2462,8,10361,45093,. @ SenatorWicker of Mississippi has been a great supporter and incredible help in getting our massive Tax Cut Bill done and approved. Also big help on cutting regs. I am with him in his re-election all the way!,-0.4199,0.923,0.452875,3,0,0
2/28/2018,2463,10,9946,48205, year low on illegal border crossings this year. Ice and Border Patrol Agents are doing a great job for our Country. MS- thugs being hit hard.,-0.8698,0.9652,0.45539,3,0,0
3/1/2018,2464,6,8941,42199,<U+201C>Consumer Confidence in February Highest Since November <U+201D>-board-consumer-confidence-february-highest-since-november- <U+2026>,-0.1759,0.8221,0.411833333,3,0,0
3/2/2018,2465,9,10563,49482,"Alec Baldwin, whose dying mediocre career was saved by his terrible impersonation of me on SNL, now says playing me was agony. Alec, it was agony for those who were forced to watch. Bring back Darrell Hammond, funnier and a far greater talent!",-0.6919,0.9381,0.102988889,3,1,0
3/3/2018,2466,4,17030,65824,Happy National Anthem Day! <U+2026>,-0.6932,0.6696,0.29315,3,,
3/4/2018,2467,1,16745,91465,"The Gridiron Dinner last night was great fun. I am accomplishing a lot in Washington and have never had a better time doing something, and especially since this is for the American People!",0.742,0.742,0.742,3,,
3/5/2018,2468,6,14422,73153,...treat our farmers much better. Highly restrictive. Mexico must do much more on stopping drugs from pouring into the U.S. They have not done what needs to be done. Millions of people addicted and dying.,-0.2619,0.7177,0.380883333,3,1,1
3/6/2018,2469,6,10815,46724,"Federal Judge in Maryland has just ruled that <U+201C>President Trump has the right to end DACA.<U+201D> President Obama had  years to fix this problem, and didn<U+2019>t. I am waiting for the Dems, they are running for the hills!",-0.7916,0.7772,-0.18265,3,1,1
3/7/2018,2470,6,973,2378,"China has been asked to develop a plan for the year of a One Billion Dollar reduction in their massive Trade Deficit with the United States. Our relationship with China has been a very good one, and we look forward to seeing what ideas they come back with. We must act soon!",-0.5759,0.8588,0.247233333,3,0,1
3/8/2018,2471,5,7779,39046,<U+201C>Presidential Proclamation on Adjusting Imports of Aluminum into the United States<U+201D> Proclamation:  Remarks:  <U+2026>pic.twitter.comrcrkpvChkz,0.4215,0.9313,0.64352,3,1,1
3/9/2018,2472,5,10474,48313,"JOBS, JOBS, JOBS! # MAGApic.twitter.comYAaqRcAZS",0,0.9144,0.60004,3,1,1
3/10/2018,2473,9,11634,57133,Chinese President XI JINPING and I spoke at length about the meeting with KIM JONG UN of North Korea. President XI told me he appreciates that the U.S. is working to solve the problem diplomatically rather than going with the ominous alternative. China continues to be helpful!,-0.8399,0.9259,0.347777778,3,,
3/11/2018,2474,7,6383,38194,"...have shown conclusively that there was no Collusion with Russia..just excuse for losing. The only Collusion was that done by the DNC, the Democrats and Crooked Hillary. The writer of the story, Maggie Haberman, a Hillary flunky, knows nothing about me and is not given access.",-0.743,0.8367,0.5221,3,,
3/12/2018,2475,6,9279,45444,"....On  to  Age Limits, watching court cases and rulings before acting. States are making this decision. Things are moving rapidly on this, but not much political support (to put it mildly).",-0.8016,0.9381,0.1096,3,0,1
3/13/2018,2476,7,13966,61731,"<U+201C>According to the Center for Immigration Studies, the $ billion wall will pay for itself by curbing the importation of crime, drugs and illegal immigrants who tend to go on the federal dole...<U+201D> <U+2026>",-0.8564,0.9033,-0.026928571,3,0,0
3/14/2018,2477,9,6174,34429,"All across this nation, we pray for our country and we THANK GOD for our United States Marines! Thank you. God Bless You. And God Bless America!pic.twitter.comvKXBdCGH",-0.281,0.9742,0.4164,3,0,0
3/15/2018,2478,5,8941,55188,It was my honor to welcome Prime Minister Leo Varadkar of Ireland to the @ WhiteHouse!pic.twitter.comZTWnIZRL,0.3157,0.8977,0.57312,3,0,0
3/16/2018,2479,5,10374,52552,<U+201C>President Donald J. Trump Delivers Remarks at the ShamrockBowl Presentation by Prime Minister Varadkar in the East Room of the White House<U+201D> pic.twitter.comZbogpAEg,0,0.9168,0.51234,3,1,1
3/17/2018,2480,4,14377,84516,"Andrew McCabe FIRED, a great day for the hard working men and women of the FBI - A great day for Democracy. Sanctimonious James Comey was his boss and made McCabe look like a choirboy. He knew all about the lies and corruption going on at the highest levels of the FBI!",-0.7982,0.5719,0.134,3,,
3/18/2018,2481,4,23065,91060,"Spent very little time with Andrew McCabe, but he never took notes when he was with me. I don<U+2019>t believe he made memos except to help his own agenda, probably at a later date. Same with lying James Comey. Can we call them Fake Memos?",-0.9495,0.7184,-0.13055,3,,
3/19/2018,2482,2,6657,44539,. @ seanhannity on @ foxandfriends now! Great! : A.M.,-0.481,0.6892,0.1041,3,0,0
3/20/2018,2483,2,18567,88463,"Our Nation was founded by farmers. Our independence was won by farmers. And our continent was tamed by farmers. Our farmers always lead the way -- we are PROUD of them, and we are DELIVERING for them! # NationalAgricultureDay",0.3722,0.8327,0.60245,3,1,0
3/21/2018,2484,6,12482,53411,".....They can help solve problems with North Korea, Syria, Ukraine, ISIS, Iran and even the coming Arms Race. Bush tried to get along, but didn<U+2019>t have the <U+201C>smarts.<U+201D> Obama and Clinton tried, but didn<U+2019>t have the energy or chemistry (remember RESET). PEACE THROUGH STRENGTH!",-0.7177,0.9485,0.150783333,3,0,0
3/22/2018,2485,7,9156,44464,"As a candidate, I pledged that if elected I would use every lawful tool to combat unfair trade, protect American workers, and defend our national security. Today, we took another critical step to fulfill that commitment.  pic.twitter.comnmzqosBUA",-0.9299,0.9617,0.467228571,3,0,0
3/23/2018,2486,5,8056,42449,DACA was abandoned by the Democrats. Very unfair to them! Would have been tied to desperately needed Wall.,-0.8647,0.2263,-0.42974,3,0,0
3/24/2018,2487,2,13267,63710,"As a matter of National Security I've signed the Omnibus Spending Bill. I say to Congress: I will NEVER sign another bill like this again. To prevent this omnibus situation from ever happening again, I'm calling on Congress to give me a line-item veto for all govt spending bills! <U+2026>",-0.9665,0.6588,-0.15385,3,,
3/25/2018,2488,7,9572,46148,"....lawyer or law firm will take months to get up to speed (if for no other reason than they can bill more), which is unfair to our great country - and I am very happy with my existing team. Besides, there was NO COLLUSION with Russia, except by Crooked Hillary and the Dems!",-0.5093,0.922,0.2471,3,,
3/26/2018,2489,4,13269,61767,". @ HowieCarrShow just wrote a book which everyone is talking about. He was a great help. He is a veteran journalist who had a great influence in NH and beyond. He calls it the most amazing political campaign of modern times. The book is called, <U+201C>What Really Happened.<U+201D> Enjoy! # MAGApic.twitter.comjYhjpoJKHe",0.2532,0.9741,0.6242,3,1,1
3/27/2018,2490,2,13131,60896,I am very pleased to welcome the opioid memorial to the President's Park in April. I encourage all to visit and remember those who we have lost to this deadly epidemic. We will keep fighting until we defeat the opioid crisis! <U+2026>,-0.3475,0.3939,0.0232,3,0,1
3/28/2018,2491,9,8262,43156,. @ USTradeRep just announced an agreement in principle with South Korea on KORUS! A great deal for American and Korean workers. Let<U+2019>s now focus on our important security relationship.,-0.3609,0.8955,0.524,3,0,0
3/29/2018,2492,4,14161,66979,"I have stated my concerns with Amazon long before the Election. Unlike others, they pay little or no taxes to state & local governments, use our Postal System as their Delivery Boy (causing tremendous loss to the U.S.), and are putting many thousands of retailers out of business!",-0.4962,0.8516,-0.129725,3,1,1
3/30/2018,2493,1,21687,78958,pic.twitter.comUMYJlUiD,0,0,0,3,,
3/31/2018,2494,3,18156,73183,"...does not include the Fake Washington Post, which is used as a <U+201C>lobbyist<U+201D> and should so REGISTER. If the P.O. <U+201C>increased its parcel rates, Amazon<U+2019>s shipping costs would rise by $. Billion.<U+201D> This Post Office scam must stop. Amazon must pay real costs (and taxes) now!",-0.9567,-0.5168,-0.7181,3,,
4/1/2018,2495,4,16485,75040,Border Patrol Agents are not allowed to properly do their job at the Border because of ridiculous liberal (Democrat) laws like Catch & Release. Getting more dangerous. <U+201C>Caravans<U+201D> coming. Republicans must go to Nuclear Option to pass tough laws NOW. NO MORE DACA DEAL!,-0.7974,0.6114,-0.09515,3,,
4/2/2018,2496,9,8056,45849,"...Congress must immediately pass Border Legislation, use Nuclear Option if necessary, to stop the massive inflow of Drugs and People. Border Patrol Agents (and ICE) are GREAT, but the weak Dem laws don<U+2019>t allow them to do their job. Act now Congress, our country is being stolen!",-0.8786,0.5411,-0.378844444,3,0,0
4/3/2018,2497,13,7928,40671,# AutismAwarenessDay # LightItUpBluepic.twitter.comJAzSEyEes,-0.8994,0.8858,0.222992308,3,1,0
4/4/2018,2498,5,15213,66388,"Our Border Laws are very weak while those of Mexico & Canada are very strong. Congress must change these Obama era, and other, laws NOW! The Democrats stand in our way - they want people to pour into our country unchecked....CRIME! We will be taking strong action today.",-0.4574,0.7351,0.29982,3,1,1
4/5/2018,2499,5,8848,44874,<U+201C>Still Rising: Rasmussen Poll Shows Donald Trump Approval Ratings Now at  Percent<U+201D>-governmentstill-rising-rasmussen-poll-shows-donald-trump-approval-ratings-now--percent <U+2026>,-0.9302,0.9538,-0.0463,3,1,1
4/6/2018,2500,6,7334,36437,<U+201C>BET founder: Trump's economy is bringing black workers back into the labor force<U+201D>-founder-trump-economy-brings-black-workers-back-into-labor-force.html <U+2026>,-0.7508,0.9381,0.157833333,3,0,0
4/7/2018,2501,5,15358,70837,Just spoke to @ JustinTrudeau to pay my highest respect and condolences to the families of the terrible Humboldt Team tragedy. May God be with them all!,-0.9006,0.7836,-0.34662,3,,
4/8/2018,2502,8,12988,60633,....to pay. Open area immediately for medical help and verification. Another humanitarian disaster for no reason whatsoever. SICK!,-0.8528,0.8775,0.1803875,3,,
4/9/2018,2503,4,8822,47719,"Congratulations to Patrick Reed on his great and courageous MASTERS win! When Patrick had his amazing win at Doral  years ago, people saw his great talent, and a bright future ahead. Now he is the Masters Champion!",0.6588,0.9899,0.7885,3,1,0
4/10/2018,2504,5,14260,72724,A TOTAL WITCH HUNT!!!,-0.5229,0.9606,0.37082,3,1,1
4/11/2018,2505,9,7207,32010,"....doing things that nobody thought possible, despite the never ending and corrupt Russia Investigation, which takes tremendous time and focus. No Collusion or Obstruction (other than I fight back), so now they do the Unthinkable, and RAID a lawyers office for information! BAD!",-0.8643,0.7088,-0.358588889,3,0,1
4/12/2018,2506,10,9316,49695,"America<U+2019>s greatest treasure is our people <U+2013> and my Administration HEARS YOUR VOICE and HAS YOUR BACK. We are fighting to give every American a future of dignity, purpose and pride. AMERICAN SPIRIT is back! # TaxCutspic.twitter.comoSGZeirBf",-0.9335,0.9676,0.50684,3,1,1
4/13/2018,2507,6,14192,70635,"....untruthful slime ball who was, as time has proven, a terrible Director of the FBI. His handling of the Crooked Hillary Clinton case, and the events surrounding it, will go down as one of the worst <U+201C>botch jobs<U+201D> of history. It was my great honor to fire James Comey!",-0.9749,0.6468,-0.2269,3,0,1
4/14/2018,2508,3,25884,93343, <U+2026>,0,0.9323,0.6099,3,,
4/15/2018,2509,8,18793,88430,"Attorney Client privilege is now a thing of the past. I have many (too many!) lawyers and they are probably wondering when their offices, and even homes, are going to be raided with everything, including their phones and computers, taken. All lawyers are deflated and concerned!",-0.8597,0.8432,0.1654125,3,,
4/16/2018,2510,2,18191,87657,"Comey drafted the Crooked Hillary exoneration long before he talked to her (lied in Congress to Senator G), then based his decisions on her poll numbers. Disgruntled, he, McCabe, and the others, committed many crimes!",0.3382,0.4819,0.41005,3,1,1
4/17/2018,2511,9,8736,49949,....Congress <U+2013> House and Senate must quickly pass a legislative fix to ensure violent criminal aliens can be removed from our society. Keep America Safe!,-0.9274,0.7574,0.209933333,3,1,1
4/18/2018,2512,11,7524,38066,. @ FLOTUS Melania and I join the Nation in celebrating the life of Barbara Bush:pic.twitter.comOWiddQx,-0.8996,0.9324,0.340309091,3,1,1
4/19/2018,2513,10,5593,28424,". @ MarshaBlackburn is a wonderful woman who has always been there when we have needed her. Great on the Military, Border Security and Crime. Loves and works hard for the people of Tennessee. She has my full endorsement and I will be there to campaign with her!",-0.9169,0.945,0.55372,3,0,0
4/20/2018,2514,9,12250,59185,"Can you believe that despite % bad stories from the Fake News Media (should be getting good stories), today we had just about our highest Poll Numbers, including those on Election Day? The American public is wise to the phony an dishonest press. Make America Great Again!",-0.7697,0.8997,0.042744444,3,0,0
4/21/2018,2515,15,9110,36713,"....it means lying or making up stories. Sorry, I don<U+2019>t see Michael doing that despite the horrible Witch Hunt and the dishonest media!",-0.8824,0.8883,0.1258,3,,
4/22/2018,2516,9,14301,79361,"....We are a long way from conclusion on North Korea, maybe things will work out, and maybe they won<U+2019>t - only time will tell....But the work I am doing now should have been done a long time ago!",-0.75,0.8066,0.218022222,3,,
4/23/2018,2517,4,19543,80654,"Despite the Democrat inspired laws on Sanctuary Cities and the Border being so bad and one sided, I have instructed the Secretary of Homeland Security not to let these large Caravans of people into our Country. It is a disgrace. We are the only Country in the World so naive! WALL",-0.899,0.7088,-0.039475,3,1,0
4/24/2018,2518,7,6020,35839,". @ JimRenacci has worked so hard on Tax Reductions, Illegal Immigration, the Border and Crime. I need Jim very badly to help our agenda and to keep MAKING AMERICA GREAT AGAIN! He will be a fantastic Senator for the Great State of Ohio, and has my full endorsement!",0,0.9201,0.579285714,3,0,0
4/25/2018,2519,6,10949,66843,". @ FLOTUS did a spectacular job hosting the President of France @ EmmanuelMacron and his wife Brigitte. Every detail was done to perfection. The State Dining Room never looked more beautiful, and Washington is abuzz over what an incredible job Melania did.",0,0.9412,0.435166667,3,1,0
4/27/2018,2520,11,9565,44441,"After a furious year of missile launches and Nuclear testing, a historic meeting between North and South Korea is now taking place. Good things are happening, but only time will tell!",-0.9536,0.9285,0.502618182,3,1,1
4/28/2018,2521,7,15957,71232,"....great people of Montana will not stand for this kind of slander when talking of a great human being. Admiral Jackson is the kind of man that those in Montana would most respect and admire, and now, for no reason whatsoever, his reputation has been shattered. Not fair, Tester!",-0.9298,0.8013,-0.1556,3,,
4/29/2018,2522,4,7154,46538,"Great evening last night in Washington, Michigan. The enthusiasm, knowledge and love in that room was unreal. To the many thousands of people who couldn<U+2019>t get in, I cherish you....and will be back!",0.3595,0.9336,0.610675,3,,
4/30/2018,2523,6,12707,67180,"<U+201C>Trump<U+2019>s Triumphs are driving his critics Crazy!<U+201D> Thank you Steve Hilton @ NextRevFNC, just want to do what is right for our wonderful U.S.A.",-0.784,0.9092,0.086083333,3,0,0
5/1/2018,2524,11,9302,49709,Congratulations @ ArmyWP_Football!pic.twitter.comrmaLoZMWtK,-0.7901,0.9493,0.568227273,3,1,0
